{
  "market_id": "MKT-002",
  "market_title": "Kharg Island no longer under Iranian control by March 31?",
  "platform": "polymarket",
  "market_probability_yes": 0.12,
  "price_yes": 0.12,
  "resolution_date": "2026-03-31T00:14:00Z",
  "market_snapshot_time": "2026-03-16T19:50:00Z",
  "category": "geopolitics",
  "market_url": "https://polymarket.com/fr/event/kharg-island-no-longer-under-iranian-control-by-march-31",
  "schema_version": "1.0"
}
