{
  "market_id": "MKT-004",
  "market_title": "US recession by end of 2026?",
  "platform": "polymarket",
  "market_probability_yes": 0.31,
  "price_yes": 0.31,
  "price_no": 0.7,
  "market_probability_no": 0.69,
  "resolution_date": "2026-12-31T00:00:00Z",
  "market_snapshot_time": "2026-03-16T20:00:00Z",
  "category": "macroeconomics",
  "market_url": "https://polymarket.com/fr/event/us-recession-by-end-of-2026",
  "schema_version": "1.0"
}
